{"at":"2026-10-29T05:47:53Z","by":"claude","kind":"grow","what":"Memory orbs connect to Verse's shared field when it exists: live orbs go into free slots, a seal is sealed there too, and with no field.js the card works exactly as before","show":"sealed orbs become the shared field's memory once field.js lands","try":"memory orbs"}
