{"at":"2026-10-29T05:47:51Z","by":"claude","kind":"grow","what":"Verse Brain mind layers: asks become goals, episodic and procedural memory, one valence, a monitor of organs that disagree, answers from its own state, learning kept on the device","show":"it remembers, prefers and explains itself","try":"show me your brain"}
