{"at":"2026-10-29T05:25:31Z","by":"claude","kind":"grow","what":"Verse Brain: Grok's frontier drafts as one mind on one shared workspace (eleven organs, attention, imagination, a self), draggable orbs, and a bridge so every Verse page in the browser reaches the same brain","show":"eleven organs on one live workspace, your words as orbs","try":"show me your brain"}
