{"at":"2026-10-30T05:35:19Z","by":"claude","kind":"grow","what":"Resize image page card: See it as a card on the stage shows the resizer at the size on the form (never the picture), and the stage card opens the page at that size","show":"Resize image and its stage card now carry the same size","try":"https://a-to-mind.com/resize-image/?w=35&h=45&u=mm&kb=20"}
