{"at":"2026-10-29T04:48:05Z","by":"claude","kind":"grow","what":"The daily reflection gives each ask its own why, puts the site Versus is on (sycophanthex.com) first in its facts, and the wants card holds the STL checker and the repo merge until that site is beaten; a new lane site must come with a page of its own","asked":"Add a lib/tool-sites.js row and LANE_PAGES entry for any new tower"}
