{"at":"2026-10-29T09:03:14Z","by":"claude","kind":"grow","what":"The made-up people page's stage card shows the people on the page: its count, countries, gender and seed","show":"/random-user/ card: the page's count, countries and seed","try":"/random-user/?n=7&nat=de,jp&seed=zz then the card link"}
