{"at":"2026-10-30T06:42:03Z","by":"claude","kind":"fix","what":"Memory orbs: what Verse newly remembers stirs the fluid where its word sits, so an orb rises there and its chip pulses; each orb is named by the word it sits near; the card rests while scrolled away, and only writes styles that changed, so it stays fast on phones","show":"New memories stir the orbs; each orb names its word","try":"https://a-to-mind.com/?q=show+me+the+memory+orbs"}
