{"at":"2026-10-29T08:26:57Z","by":"claude","kind":"grow","what":"The random number page's stage card draws from the range on the page, and the card links back to the page on that range","show":"Random number card draws from the page's range, links back to it","try":"/random/ with From -5 To 5, press See it as a card on the stage"}
